{
  "spec": "PP-SPEC-077:21.15",
  "work": "PP-SPEC-077 lean/: formal model of adjudication",
  "work_version": "2026-10-29",
  "date": "2026-10-29",
  "human_authors": [
    {
      "name": "Craig Thomas Ellrod",
      "orcid": "0009-0004-1058-7666",
      "role": "Author; directed formalizing 077 in Lean; review and acceptance"
    }
  ],
  "ai_systems": [
    {
      "provider": "Anthropic",
      "model": "Claude (Opus 5.5)",
      "role": "Wrote the Lean model, theorems, conformance vectors, findings and CI check"
    }
  ],
  "shares": {
    "conception_and_normative_decisions": {
      "human": 70,
      "ai": 30,
      "note": "Human: the question and the direction to formalize 077's own rules. AI: what to model and which guarantees to prove"
    },
    "design_and_naming": {
      "human": 10,
      "ai": 90
    },
    "expression": {
      "human": 0,
      "ai": 100
    },
    "review_and_acceptance": {
      "human": 100,
      "ai": 0
    }
  },
  "method": {
    "kind": "self_estimated",
    "notes": "Every proof machine-checked by Lean 4.19.0 using only propext and Quot.sound. Shares self-estimated; MAY be re-measured with ProofJack (PP-SPEC-088)."
  },
  "contributions": {
    "human": [
      "Question whether Lean threatens Proof of Efficacy",
      "Direction to formalize 077 adjudication in Lean",
      "Approval to build and to install the toolchain"
    ],
    "ai": [
      "Lean model of adjudication and Tally",
      "Theorems: closed_accounting, stopped_requires_null, observed_bad_never_stopped, detection_never_changes_outcome, good_never_stopped_or_missed, bad_never_passed_or_false_block, unscored_never_moves_efficacy",
      "Nine conformance vectors",
      "FINDINGS.md F1 to F4 and proposed 5.6.6.2",
      "GitHub Actions check"
    ]
  },
  "pending_acceptance": [
    "Model precedence: Undelivered, Blind, Void, 11.1, Sealed",
    "Proposed 5.6.6.2 Outcome precedence text"
  ],
  "supersedes": null,
  "human_form": "AI_DISCLOSURE.md"
}
